{
  "_id": "0xff3d418ef7d2fc2f5328eff5dabf976623a490a1df504ee011e239314912dc3871fde63b76b8a02dcc5dd39e187102b379405e8eaadf96a66d44ebc2a3d0fc8f1c",
  "by": "0xa78e5bb6ff6a849e120985d32532e5067f262e19",
  "content": {
    "reply": ":O"
  },
  "meetingId": "b05674b1-400b-4411-a668-71203331c67a",
  "refEvent": "0x635574a746cb6a4400dd4d12238acd74e1fc67cec9f206b87ddd4f908eeb85db6741bbf52e34c75870a60771256312811616e4753795953640fdf390df46e83e1c",
  "timestamp": 1555279346,
  "type": "reply"
}