{
  "_id": "0xd7169b0c864d105f890024a6f8b8ceb4a78319ffb4024f2164e4eb087cb743a06b96d1ade5542400210e5c1058c55466a807c7ec608d7d87b465bbec3a000c031c",
  "by": "0xa78e5bb6ff6a849e120985d32532e5067f262e19",
  "content": {
    "vote": "e0546c112eed8ca1c3e09f8b2b9e97a103e5daf7f560fe8e63c4fb97dc591977fb44dfb2c405c22d8b1b0739bd7ed92e006ce99b74eb3a905b6f8326b5db7b1950dd2d9deba1a457833f691e5b0b37a395f034ed365d78d0824079680020cb37d204c81757e43b96b3190d7ccf41673fbdfbced2a06587a34de3d06d71f74e453d164bb0c7eab640d41d9733ecf30fa8e2a36d823565353e324796679711157e671b9be586f2e931098e3714ea26972eb6b953995b1a1b6c337739147ba425ac2992ff0858664bc82b9e769bab6066744c77402656a97aec42b8062e3a97f37af38be04f983301ccc1a3797c4954e21d022c8b44a714281484712927c2838ff70ec9d4a9b49f8e8a59eb77b30f084f8bb392043c1eb3ccbee04d653bed4ee8b1af"
  },
  "meetingId": "b05674b1-400b-4411-a668-71203331c67a",
  "refEvent": "0xb617545aa4286cf093f13d226819780e6996f9a5a931b13b82c033db8c2c83fd48345903ea3fdbac6a1f20b68491fea9f503642370ca25723a0c6d08d7e18de61b",
  "timestamp": 1555285064,
  "type": "vote"
}